{
  "reportId": "urn:mu:validation:minimal-person:2026-06-27",
  "target": {
    "id": "urn:mu:metamodel:minimal-person",
    "version": "1.0.0",
    "fingerprint": "sha256:a628b2afb96dc673f7e2f9161569e573fc70892d10a6997fad7aaa14b04a639d"
  },
  "validator": { "id": "urn:mu:validator:reference", "version": "ws3-draft" },
  "validatedAt": "2026-06-27T00:00:00Z",
  "highestLevelAchieved": "V4",
  "levels": [
    {
      "level": "V0",
      "status": "pass",
      "checks": [
        { "checkId": "V0-01", "status": "pass", "severity": "error", "enforces": ["MUIF-R02", "MUIF-R03"] },
        { "checkId": "V0-02", "status": "pass", "severity": "error", "enforces": ["MUIF-R01"] }
      ]
    },
    {
      "level": "V1",
      "status": "pass",
      "checks": [
        { "checkId": "V1-01", "status": "pass", "severity": "error", "enforces": ["MUIF-R01"] },
        { "checkId": "V1-02", "status": "pass", "severity": "error", "enforces": ["MUIF-R01"] },
        { "checkId": "V1-03", "status": "pass", "severity": "warning", "enforces": ["MMAS-CORE"] }
      ]
    },
    {
      "level": "V2",
      "status": "pass",
      "checks": [
        { "checkId": "V2-01", "status": "pass", "severity": "error", "enforces": ["MUC-R03"] },
        { "checkId": "V2-02", "status": "pass", "severity": "error", "enforces": ["MUC-R15"] },
        { "checkId": "V2-03", "status": "pass", "severity": "error", "enforces": ["NAME"] },
        { "checkId": "V2-04", "status": "pass", "severity": "warning", "enforces": ["REL"] },
        { "checkId": "V2-05", "status": "pass", "severity": "error", "enforces": ["MUIF-R12", "MUIF-R18"], "message": "Computed fingerprint matches across both serializations (person.muif.json, person.variant.json)." }
      ]
    },
    {
      "level": "V3",
      "status": "pass",
      "checks": [
        { "checkId": "V3-01", "status": "pass", "severity": "error", "enforces": ["MUC-R03", "MUC-R04"] },
        { "checkId": "V3-02", "status": "pass", "severity": "error", "enforces": ["MUC-R12", "MUC-R13", "MUC-R14"] },
        { "checkId": "V3-03", "status": "pass", "severity": "error", "enforces": ["MUC-R11"] },
        { "checkId": "V3-04", "status": "pass", "severity": "error", "enforces": ["MUC-R21", "MUC-R22", "MUC-R25"], "location": "projections[0]", "message": "Public projection is governed by contract person:contract:hr-disclosure with purpose 'Public directory listing'." },
        { "checkId": "V3-05", "status": "pass", "severity": "warning", "enforces": ["MUC-R08", "MUC-R10"] },
        { "checkId": "V3-06", "status": "pass", "severity": "warning", "enforces": ["MUC-R15", "MUC-R16"] }
      ]
    },
    {
      "level": "V4",
      "status": "pass",
      "checks": [
        { "checkId": "V4-01", "status": "pass", "severity": "error", "enforces": ["MUC-R17", "MUC-R18", "MUC-R19", "MUC-R20"] },
        { "checkId": "V4-02", "status": "pass", "severity": "error", "enforces": ["MUC-R21"] },
        { "checkId": "V4-03", "status": "pass", "severity": "error", "enforces": ["MUIF-R12"] },
        { "checkId": "V4-04", "status": "skipped", "severity": "warning", "enforces": ["EXT"], "message": "No external standards imported by this model." }
      ]
    },
    {
      "level": "V5",
      "status": "skipped",
      "checks": [
        { "checkId": "V5-01", "status": "skipped", "severity": "info" },
        { "checkId": "V5-02", "status": "skipped", "severity": "info" }
      ]
    }
  ],
  "summary": { "errors": 0, "warnings": 0, "info": 0 }
}
